,Name,User_name,Date,Content,Comments,Forward,Like,language,1,Restaurant
0,creativequotes,@freeusaquotes·2022年12月24日,2022-12-24,Boucherie West Village,,,,3,fr,Boucherie West Village 
1,Jake Reynolds,@pastrygoth·2022年12月20日,2022-12-20,I went to Boucherie west village and Thomas Keller wasn't there what gives,,,,22,en,Boucherie West Village 
2,Putaforkinit_,@ig_putaforkinit·2022年12月16日,2022-12-15,"Boucherie  Your Above Average Butcher Shop••@boucherienycWest Village, NYC•• @ Boucherie West Village",,,,5,en,Boucherie West Village 
3,Raven__ous,@MelinaPavlakou·2022年12月9日,2022-12-09,Boucherie West Village and La Vie En Rose cocktail...το δικαιούμαι! Cheers!,5,4,28,und,,Boucherie West Village 
4,Nanaka ,@nanaka9·2022年11月24日,2022-11-24,Just posted a photo @ Boucherie West Village,,,,en,,Boucherie West Village 
5,creativequotes,@freeusaquotes·2022年11月19日,2022-11-19,Boucherie West Villagehttps://classifiedsmarketing.com/?p=952&feed_id=17584…,,,,fr,,Boucherie West Village 
6,creativequotes,@freeusaquotes·2022年11月10日,2022-11-10,Boucherie West Villagehttps://classifiedsmarketing.com/?p=952&feed_id=11194…,,,,fr,,Boucherie West Village 
7,Tog emot nya svar,@mariabrostrom·2022年10月31日,2022-10-31,"Har varit där fyra gånger! Kul med NFL, det har jag inte upplevt.Om du inte testat pizzan på Roberta’s i Brooklyn rekommenderar jag det varmt! Och frukost/brunch på Viand Coffee Shop på Madison Ave eller Boucherie i West Village.",1,,1,sv,,Boucherie West Village 
8,Lisa,@HarrerTomi·2022年10月17日,2022-10-16,"I have been to Boucherie West Village twice, I prefer West Village to be more cosy, but both are beautiful, it also has Union Square and the same menu as Petite Boucherie in West Village",,,,en,,Boucherie West Village 
9,Mark Zinni,@MarkZinni·2022年10月2日,2022-10-01,Spectacular Saturday selfie in the city. @ Boucherie West Village,,,2,en,,Boucherie West Village 
10,Always Green Carpet Cleaner NYC,@nyc__cleaning·2022年9月30日,2022-09-30,Do you want to revive your dusty and worn carpets at an affordable price? Call Always Green Carpet Cleaner and our  steam cleaning will make your carpets look like new again. In this video we are cleaning the carpets at Boucherie West Village. #carpetcleaning #steamcleaning,,,,en,,Boucherie West Village 
11,mel misses harry ,@sunflwermelody·2022年8月29日,2022-08-29,Boucherie in West Village has really good almond croissants and waffles!,,,,en,,Boucherie West Village 
12,Tog emot nya svar,@mariabrostrom·2022年8月26日,2022-08-26,"Gotham Bar & Grill, säger jag då. 28 dagars hängmörad stek, om de har den kvar. Bästa jag ätit i hela mitt liv.Pizza ska ni äta på Roberta’s i Brooklyn.Boucherie i West Village eller Viand Coffee Shop på Supper East för frukost/brunch.",,,1,sv,,Boucherie West Village 
13,Felito__144,@Kasanova144·2022年8月26日,2022-08-26,"Scalini Fedeli, Boucherie west village,Momosan (if you like ramen and sushi), Pastis, Scarpetta, Chart House (great views of the city, Porto Leggero. Let me know if you need more. I gave you a few of each kind of dish.",,,1,en,,Boucherie West Village 
14,Lynn,@LRick1960·2022年8月23日,2022-08-23,NYC two weeks ago Boucherie West Village. Porterhouse for two. Absolutely the best steak we had ever tasted. From appetizers to dessert to wine the whole meal was memorable. Service was impeccable.,,,4,en,,Boucherie West Village 
15,mel misses harry ,@sunflwermelody·2022年8月21日,2022-08-20,Boucherie in the West Village has great waffles (kind of expensive  $16 waffles but house made jam ) ad almond croissants! Battery park! The Met (would do on same day as central park),,,1,en,,Boucherie West Village 
16,ANI - youngyogi.eth,@youngyogi96·2022年8月4日,2022-08-04,Boucherie in the west village… very romantic spot if you’d like to join,,,,en,,Boucherie West Village 
17,Gamma trader,@csteve360·2022年8月2日,2022-08-02,#nyc #boucherie @ Boucherie West Village,,,,fr,,Boucherie West Village 
18,𝖇eci ,@simpkkuno·2022年6月7日,2022-06-07,"wooo have fun!high line, dumbo area, and west village are all pretty places to visit!soho, hudson yards, and midtown if you like shoppingeats: boucherie (french), pecora bianca (italian), rubirosa (pizza), five senses (korean), friedmans (brunch), 12 chairs (middle eastern)",1,,41,en,,Boucherie West Village 
19,PrachyaKlong,@PrachyaKlong·2022年6月4日,2022-06-04,"05282022 West Village, Manhattan, New York, NY USA#klong #thaitayan #travel #lifestyle #westvillage #manhattan #newyork #ny #newyorkcity #nyc #usa @ Boucherie West Village",,,,en,,Boucherie West Village 
20,PrachyaKlong,@PrachyaKlong·2022年5月29日,2022-05-29,I checked in at Boucherie West Village on #Yelp,,,,en,,Boucherie West Village 
21,jpmuzz,@jpmuzz·2022年4月16日,2022-04-16,West Village. #motoguzzi #petiteboucherie #westvillage #jpmuzz @ Petite Boucherie,,,,fr,,Boucherie West Village 
22,𝓝𝗂𝗑𝗂𝖾 𝓘𝗏𝖺𝗌𝗁𝗄𝗈𝗏.,@whatcverittakss·2022年3月24日,2022-03-24,"En ese caso puedo recomendarte el ""Boucherie West Village"", es tranquilo, tiene un estilo relajado y familiar. Se come muy rico, espero te sirva.",1,,,es,,Boucherie West Village 
23,NYC ALL DAY 24/7 ,@nycallday247·2022年3月18日,2022-03-18,Brunch at Boucherie West Village.https://meetup.com/big-apple-beauties-30s-50s/events/283933826… via @Meetup @BoucherieNYC#Boucherie #WestVillage #NYC #BoucherieNYC,,,,en,,Boucherie West Village 
24,brandonbeckhardt,@bebeckhardt·2022年1月18日,2022-01-18,"Harry’s in FiDi, The Standard Grill, Boucherie West Village, Raines law room Chelsea for drinks",,,1,en,,Boucherie West Village 
25,Dusty Pee,@DustyPee·2022年1月11日,2022-01-11,"Boucherie, West Village. Oui!",1,1,1,fr,,Boucherie West Village 
26,Sha Sha,@francescatututu·2021年12月29日,2021-12-29,Update: I met him at Boucherie in the West Village. Food & drinks were yummy. We sat outdoors in a heated spot. No other people.I love seeing my baby.I’m good.Thanks all who sent me advice.,,,12,en,,Boucherie West Village 
27,𝐱,@stoopsound·2021年12月27日,2021-12-27,Which Boucherie is better? West Village or Union Square?,1,,,en,,Boucherie West Village 
28,McMillan D.M.T.,@McMillNY·2021年12月16日,2021-12-16,"In NYC, Balthazar and Boucherie West Village.",,,,en,,Boucherie West Village 
29,Lorraine & Bob Jacobsen,@LorraineAndBobJ·2021年12月13日,2021-12-13,Have you ever been to Boucherie West Village? Would you recommend it? https://yelp.com/biz/boucherie-west-village-new-york-3?adjust_creative=oL3IFSLKuAvBuqJLVWV6Dw&utm_campaign=yelp_api_v3&utm_medium=api_v3_business_search&utm_source=oL3IFSLKuAvBuqJLVWV6Dw…,,,,en,,Boucherie West Village 
30,miss bad mama jama ,@Curls_n_Tumbao·2021年11月26日,2021-11-26,It’s Boucherie in West Village! Super cute and poppin’,,,1,en,,Boucherie West Village 
31,nestor,@lildvlpr·2021年10月31日,2021-10-31,Boucherie in the west village is pretty good,,,1,en,,Boucherie West Village 
32,jpmuzz,@jpmuzz·2021年10月21日,2021-10-21,West Village Wine…. #westvillage #petiteboucherie @ Petite Boucherie,,,,en,,Boucherie West Village 
33,Paul Masson,@paulmassonbrand·2021年10月14日,2021-10-14,"My brother-in-law was denied entry to Boucherie West Village (pre-pandemic) for wearing a t-shirt that read ""BORN 2 SH*T / FORCED 2 WIPE"" because it was against the dress code, so yes, the stylish/unstylish binary is a ""violent hierarchy"" (to borrow the terminology of Derrida.)",,,,en,,Boucherie West Village 
34,By.Lavache,@ByLavache·2021年10月9日,2021-10-09,I checked in at Boucherie West Village on #Yelp https://yelp.com/biz/boucherie-west-village-new-york-3?pt=check_in&ref=twitter&utm_campaign=CheckIn&utm_medium=twitter&utm_source=ishare&v=4b…,,,,en,,Boucherie West Village 
35,mom of a terror tot,@prplehaiz·2021年9月28日,2021-09-27,Soooo happy for the first IRL event!  (@ Elite Event: Happy Hour at Boucherie West Village) on #Yelp https://yelp.com/biz/elite-event-happy-hour-at-boucherie-west-village-new-york?pt=check_in&ref=twitter&utm_campaign=CheckIn&utm_medium=twitter&utm_source=ashare&v=4b…,,,,en,,Boucherie West Village 
36,THEESPNHATER,@theespnhater·2021年8月15日,2021-08-15,Boucherie in the West Village area.,,,1,en,,Boucherie West Village 
37,metaphorical gin and juice,@drums_and_space·2021年7月9日,2021-07-09,Thinking about going to Boucherie West Village with @angryseattlegay and @eatingburrata before the best meal of our lives just to get martinis and beef tartare. I almost puked when I tried the tartare. Make it make sense!!,,,1,en,,Boucherie West Village 
38,just in case,@jjcoast·2021年5月8日,2021-05-08,Happy as all hell that you won. I just treated myself to Boucherie in the west village with $55 steak so I’m loving it up also,1,,2,en,,Boucherie West Village 
39,News and Nonsense,@sumbodysaidthat·2021年4月18日,2021-04-18,"Buzzzz-o-Meter: Lake & Skye Perfume, Boucherie West Village and More That Hollywood Is … https://mrmikefrost.com/buzzzz-o-meter-lake-skye-perfume-boucherie-west-village-and-more-that-hollywood-is/…",,,,en,,Boucherie West Village 
40,alex atallah,@aatallah95·2020年12月17日,2020-12-17,@NycIndoor La Contenta Oeste in the West Village. Petite Boucherie in the West Village. Trattoria L’Incontro in Astoria uncovered snow.,2,,3,en,,Boucherie West Village 
41,Macks Julien,@MacksJulien·2020年11月18日,2020-11-18,Boucherie West Village is also fire. Great place if you have a group they got a steak course that can feed an army.,2,,1,en,,Boucherie West Village 
42,Si_Dilli,@sii_dilli·2020年10月24日,2020-10-24,Midtown Comics at Times Square and Boucherie in West Village Tomorrow for my birthday,,,1,en,,Boucherie West Village 
43,Ryan Donovan,@ryan__donovan·2020年10月3日,2020-10-03,"also saw Joseph Leonard, Petite Boucherie in West Village definitely above 25% capacity indoors. who are these people???",,,1,en,,Boucherie West Village 
44,よっしーのNYレポ,@nBeIwGyAoPrPkLE·2020年9月26日,2020-09-26,華金はWest VillageのBoucherieで内装も外装もとってもオシャレなのはもちろんのこと、ここのステーキが柔らかくてとにかく美味しい天気も気持ちよくてOutdoor Seating日和#ニューヨーク #在米Yelp部,,,2,ja,,Boucherie West Village 
45,Rich O'Toole,@RichOToole·2020年9月7日,2020-09-07,French Onion Soup at Boucherie in the West Village. #OTooleEatsNYC,6,2,37,en,,Boucherie West Village 
46,Steph,@YeahFoodBeer·2020年5月2日,2020-05-02,"Not to pour it on thick, but every time I’ve gone to boucherie in the West Village I’ve left really happy and satisfied . It’a been a pretty long time since my last visit and this is from the launch of their…",,,1,en,,Boucherie West Village 
47,sophie bee ,@Ana_xSophie·2020年3月31日,2020-03-31,FINALLY figured out the entirety of my itinerary for New York this summer!I’ll be eating within my own limits at the following places (thanks to help from all of you!):-Boucherie (West Village)-Westville-Monkey Bar-DelimarieSomeone say it’s okay to be excited for this pls,1,,4,en,,Boucherie West Village 
48,karenine ,@kareninehk·2020年3月12日,2020-03-12,#TBT to French lunchtime classics in the West Village! ....#steaktartare #steak #tartare #raw #boucherie #boucherienyc #nyc #citylife #french #france #paris #lunch #brunch #restaurantweek #dinner #drinks… https://instagram.com/p/B9o5Qd1HI73/?igshid=f06dup2jgj4g…,,,,en,,Boucherie West Village 
49,TravelAdikkt,@TravelAdikkt·2020年2月11日,2020-02-11,Boucherie West Village | ADIKKT#travel #beautifuldestination #travelgram #traveladdict #bestvacations #amazingplaces #travelblogger #travels #travelphotography #solotravel #luxuryhotel #travelgirls #beautifuldestinations #travelblog #traveladikkt,,,,no,,Boucherie West Village 
50,Vem Pra NY,@vemprany·2020年1月29日,2020-01-29,"/ Você viu antes nos Stories!Boucherie é uma brasserie francesa, que celebra o Joie de Vivre. Com 3 unidades em Nova York (West Village, Union Square e o Petit Boucherie, também no West Village), tem aquele… https://instagram.com/p/B76NxgPnpuZ/?igshid=gkd20qixfovw…",,2,4,pt,,Boucherie West Village 
51,Daetwan Williams,@TheRealDaetwan·2020年1月18日,2020-01-18,I'm all about that french food so I'm going with Boucherie West Village,,,,en,,Boucherie West Village 
52,Marcus & Millichap,@MMI_NYC·2019年12月10日,2019-12-10,"Earlier the year, John Stewart, Joshua Bluestein, and Nicholas Biedron sold The Boucherie— take a look inside! #retailproperty #icscnydm @ West Village https://instagram.com/p/B55epCRn_mr/?igshid=1momhu6hnj0rq…",,1,3,en,,Boucherie West Village 
53,Michael DiSarno,@mldisarno·2019年11月27日,2019-11-27,"Have you been to @boucherienyc in the West Village yet? If not, you do not know what you are missing. Boucherie is a beautiful 320 seat brasserie. Jerom Dihui, the Executive chef, grew up in the Côte d’Ivoire. He is… https://instagram.com/p/B5Wl7mgnPnb/?igshid=6l8zaocslowv…",,,,en,,Boucherie West Village 
54,Sean Keever,@BoomBoomBBQ·2019年11月13日,2019-11-13,"Wagyu portion of the Gotham Burger Social Club “Whiskey & Wagyu”, Boucherie West Village; .Chateaubriand..This filet, dusted in coffee served with sauce perigourdine along side bone marrow and parsnip purée was a perfect showcase for the Kow Steaks wa… https://ift.tt/2CDNZtJ",,,1,en,,Boucherie West Village 
55,Ramon Imery,@zymval·2019年10月3日,2019-10-03,Missed me Lamb Chops! @boucherie west village,,,,en,,Boucherie West Village 
56,Warner,@goldandsarcasm·2019年9月28日,2019-09-28,"« juntos hoy, así que yo invito, me recomendaron Boucherie West Village y lo quiero conocer... pero como sea, ya veremos eso más tarde ¿cómo marcha todo? No he podido hablar contigo porque estaba ocupado buscando trabajo esta semana, aunque »",1,,,es,,Boucherie West Village 
57,Marcus & Millichap,@MMI_NYC·2019年9月24日,2019-09-24,"Closed | West Village | $11,000,000 | Listed by nycbuildingadvisors @ Boucherie https://instagram.com/p/B2zPUPtHzYn/?igshid=140zi1kw3s723…",,,2,en,,Boucherie West Village 
58,Eater NY,@EaterNY·2019年3月8日,2019-03-08,Meaty West Village French brasserie Boucherie is eyeing a new location on the Upper West Side https://ny.eater.com/2019/3/8/18255994/boucherie-upper-west-side-expansion-nyc?utm_campaign=ny.eater&utm_content=chorus&utm_medium=social&utm_source=twitter…,,,5,en,,Boucherie West Village 
59,Charlene Ngamwajasat,@doctorcharlene·2019年2月24日,2019-02-24,Gorgeous mousse au chocolat w fresh berries at Boucherie in the West Village.,,,,en,,Boucherie West Village 
60,It’s Barbie,@ClassyGirlMia·2019年2月21日,2019-02-21,Boucherie in West Village,1,,,fr,,Boucherie West Village 
61,Jackie Clair,@jclair24·2019年2月16日,2019-02-16,"One of my favorite restaurants, featured in my mini West Village Guide - link’s in my bio if you missed it!  #petiteboucherie #westvillage @ Petite Boucherie",,,,en,,Boucherie West Village 
62,Tim Kirk,@timmmyk·2019年1月28日,2019-01-28,Boucherie West Village Restaurant Week. https://instagram.com/p/BtKXibAHLUa/?utm_source=ig_twitter_share&igshid=102khy4pez65r…,,,,fr,,Boucherie West Village 
63,Old Fashioned Mom,@Oldfashmom·2019年1月16日,2019-01-16,Boucherie... most divine French restaurant in the west village. #afterschool #conversation #baked #brie #pappardelle #michellemarieheinemann #hyacinthheinemann @boucherienyc @ Petite… https://instagram.com/p/BsrTld_nqmU/?utm_source=ig_twitter_share&igshid=hqgut38int06…,,,,en,,Boucherie West Village 
64,Monica Bruno Makeup,@MBpromakeup·2019年1月1日,2019-01-01,HAPPY NEW YEAR!! Celebrando el primer día del año en West Village NY con súper Brad!! ADORE!#holanewyork#happynewyear#hello19 #laboucherie#village#myplace#great#enjoy #vacation#winter#loveit# @ Boucherie — at Boucherie https://facebook.com/213462582018569/posts/2238429762855164/…,,,,en,,Boucherie West Village 
65,Max Guliani,@maximusupinNYc·2018年12月29日,2018-12-29,A wet nightfall outside Boucherie in West Village #NYC,13,44,182,en,,Boucherie West Village 
66,caffeine queen,@vicallaire·2018年12月24日,2018-12-24,"I gotchu! Kiki’s, cafe medi, officina 1M, DEZ, 1803 NYC, olio e piú, boucherie west village, old rose, Shuka, Chinese tuxedo, raviolo, lil frankie’s ,  lea’s on courtelyou is THE BEST, Palma.",2,,,en,,Boucherie West Village 
67,BHHS MP Realty,@bhhsmprealty·2018年11月22日,2018-11-22,Rumor has it that Boucherie West Village is one of the best French restaurants in town. Do you agree? http://r.trendinghomenews.com/2ifwr,,,,en,,Boucherie West Village 
68,BHHS MP Realty,@bhhsmprealty·2018年11月22日,2018-11-22,Rumor has it that Boucherie West Village is one of the best French restaurants in town. Do you agree? https://yelp.com/biz/boucherie-west-village-new-york-3?adjust_creative=oL3IFSLKuAvBuqJLVWV6Dw&utm_campaign=yelp_api_v3&utm_medium=api_v3_business_lookup&utm_source=oL3IFSLKuAvBuqJLVWV6Dw…,,,,en,,Boucherie West Village 
69,Zachary Ibarra,@zachary_ibarra·2018年11月17日,2018-11-17,Bonjur from Le Petite Boucherie in the West Village,1,,2,fr,,Boucherie West Village 
70,Appetizer Food Tours,@appetizer_tours·2018年7月2日,2018-07-02,"RT EaterNY ""Meaty French brasserie Boucherie now has a smaller outpost in the West Village — and more openings around NYC https://ny.eater.com/2018/4/4/17199660/spring-summer-recent-nyc-restaurant-openings-2018…""",,,,en,,Boucherie West Village 
71,Eater NY,@EaterNY·2018年7月2日,2018-07-02,Meaty French brasserie Boucherie now has a smaller outpost in the West Village — and more openings around NYC https://ny.eater.com/2018/4/4/17199660/spring-summer-recent-nyc-restaurant-openings-2018…,,,1,en,,Boucherie West Village 
72,Ashley,@Ashley_J_W·2018年6月10日,2018-06-10,"Had lunch at Boucherie, west village yesterday... Loved it, great feel and good food http://boucherie.nyc/gallery/",,,2,en,,Boucherie West Village 
73,adriana ramos,@adrianaramos·2018年6月7日,2018-06-07,I checked in at Boucherie - West Village on #Yelp,,,,en,,Boucherie West Village 
74,Steven Kennedy,@SteveKennedyAz·2018年5月11日,2018-05-11,Dinner...   so delicious I didn’t get a chance to take a photo! (@ Boucherie - West Village) #Yelp #Yelfie https://yelp.com/biz/boucherie-west-village-new-york-2?pt=check_in&ref=twitter&utm_campaign=CheckIn&utm_content=moment_checkin&utm_medium=twitter&utm_source=ishare&v=4b…,,,,en,,Boucherie West Village 
75,Steph Corpuz,@stephcorpuz·2018年5月6日,2018-05-06,Surprise!!!! Dinner for the bride to be. M (@ Boucherie - West Village) on #Yelp https://yelp.com/biz/boucherie-west-village-new-york-2?pt=check_in&ref=twitter&utm_campaign=CheckIn&utm_medium=twitter&utm_source=ishare&v=4b…,,,,en,,Boucherie West Village 
76,Sarah A. Victoria,@sarsisaboss·2018年5月6日,2018-05-06,I checked in at Boucherie - West Village on #Yelp https://yelp.com/biz/boucherie-west-village-new-york-2?pt=check_in&ref=twitter&utm_campaign=CheckIn&utm_medium=twitter&utm_source=ishare&v=4b…,,,1,en,,Boucherie West Village 
77,Carol Staab,@CarolSellsNY·2018年4月29日,2018-04-29,Leisurely Sunday brunch at Boucherie in the West Village . You will think you are in Paris! Best… https://instagram.com/p/BiKwUC4na82/,,,,en,,Boucherie West Village 
78,Sacha GoingCali,@TheSachaFierce·2018年4月6日,2018-04-06,Boucherie - West Village on #Yelp: Amazing restaurant! The best French onion soup that I've ever had & the most per… https://yelp.com/biz/boucherie-west-village-new-york-2?hrid=k3JUwtWz7HKppgt4COmyfw&pt=review&ref=twitter&utm_campaign=Review&utm_medium=twitter&utm_source=ishare&v=3…,,,2,en,,Boucherie West Village 
79,workout,@victortorchia1·2018年3月31日,2018-03-31,"Boucherie - West Village on #Yelp: What a lovely brunch for us, great atmosphere, delicious food & good service. Gr… https://yelp.com/biz/boucherie-west-village-new-york-2?hrid=74a8IkQMY10GVaqBgxRZGw&pt=review&ref=twitter&utm_campaign=Review&utm_medium=twitter&utm_source=ishare&v=3…",,,,en,,Boucherie West Village 
80,Appetizer Food Tours,@appetizer_tours·2018年2月25日,2018-02-25,"RT EaterNY ""West Village French brasserie and steakhouse Boucherie has expanded to Gramercy Park https://ny.eater.com/2018/2/14/17012386/boucherie-gramercy-park-nyc-location-open-menu…""",,,,en,,Boucherie West Village 
81,Eater NY,@EaterNY·2018年2月25日,2018-02-25,West Village French brasserie and steakhouse Boucherie has expanded to Gramercy Park,,1,4,en,,Boucherie West Village 
82,I Just Want To Eat™,@ijustwanttoeat·2018年2月21日,2018-02-21,"We recently discovered Boucherie, butcher shop in French, a restaurant in the West Village that is conveniently... https://fb.me/S4FDw8fU",,,,en,,Boucherie West Village 
83,Boucherie NYC,@BoucherieNYC·2018年2月12日,2018-02-12,"Valentine's Day is just two days away. We're booked at our West Village location, but there's still some room at our new Boucherie location at 225 Park Avenue South. Reservations are open on OpenTable. http://ift.tt/2F0neAm",,,,en,,Boucherie West Village 
84,Killian,@Kil_Car·2018年2月7日,2018-02-07,Boucherie in the West village for definite. Beautiful French restaurant with all the classics and an unbelievable wine list,,,,en,,Boucherie West Village 
85,Steph,@YeahFoodBeer·2018年1月31日,2018-01-31,"Not to pour it on thick, but every time I’ve gone to boucherie in the West Village I’ve left… https://instagram.com/p/BeoYzzuHLYV/",,,,en,,Boucherie West Village 
86,Food Porn NY,@Food_Porn_NY·2018年1月22日,2018-01-22,"ⒷⓄⓊⒸⒽⒺⓇⒾⒺ |  99 7th Avenue South, West Village, NY. [ boucherienyc ] Tomahawk® 40oz Tomahawk…",,1,,en,,Boucherie West Village 
87,Ilmioviaggioanewyork,@ilmioviaggioany·2017年12月22日,2017-12-22,"Amici, nel West Village c'è un ristorante francese che si chiama Boucherie. Ho mangiato una carne fantastica,... https://fb.me/9gkQDJsdR",,,,it,,Boucherie West Village 
88,Killian,@Kil_Car·2017年12月4日,2017-12-04,"@mickconlan11 come into Boucherie in the West village after Wednesday's game, we'll treat you well!",,,,en,,Boucherie West Village 
89,Gin Lane 1751,@ginlane1751·2017年10月22日,2017-10-22,"Mon cherie, Boucherie! This little French restaurant in the West Village, @BoucherieNYC, is perfect for dinner and (gin) cocktails.",,1,3,en,,Boucherie West Village 
90,Areta's StyleSecrets,@AretaChen·2017年7月30日,2017-07-30,{Feeling French}  A little piece piece of Paris right in the heart of West Village. @ Boucherie https://instagram.com/p/BXLZVYmhRPU/,,,,en,,Boucherie West Village 
91,Vladan Mijatovic,@vladanmusic·2016年12月25日,2016-12-25,"Christmas brunch at this  beautiful restaurant ""Boucherie"" in West Village and of course my… https://instagram.com/p/BOc6N6Agzxq/",,,,en,,Boucherie West Village 
92,William Lee,@restaurantsdeal·2016年12月13日,2016-12-13,Boucherie Now Slinging Steak And French Classics In Massive West Village Space http://ny.eater.com/2016/12/9/13898672/boucherie-nyc-opens?utm_campaign=ny.eater&utm_content=entry&utm_medium=social&utm_source=twitter… via @EaterNY,,,,en,,Boucherie West Village 
93,Nelson Albornoz Niño,@Nelsonali·2016年12月10日,2016-12-10,Boucherie Now Slinging Steak And French Classics In Massive West Village Space http://ny.eater.com/2016/12/9/13898672/boucherie-nyc-opens?utm_campaign=ny.eater&utm_content=entry&utm_medium=social&utm_source=twitter… vía @EaterNY #enjoy,,,,en,,Boucherie West Village 
94,IPS News,@ipsnewsmedia·2016年12月10日,2016-12-10,Now Open: Meat Us at @boucherienyc in the West Village #ipsnews #boucherie #dining #nyc #newyorkcity #westvillage http://fb.me/8w71zIdU6,,,1,en,,Boucherie West Village 
95,Scott Green,@scottgipsnews·2016年12月10日,2016-12-10,Now Open: Meat Us at boucherienyc in the West Village #ipsnews #boucherie #dining #nyc… https://instagram.com/p/BN1IO1yDvN-/,,,,en,,Boucherie West Village 
96,IPS News,@ipsnewsmedia·2016年12月10日,2016-12-10,Now Open: Meat Us at Boucherie in the West Village http://internetpressservice.com/?p=3886,,,,en,,Boucherie West Village 
97,IPS News,@ipsnewsmedia·2016年12月10日,2016-12-10,Now Open: Meat Us at Boucherie in the West Villagehttp://internetpressservice.com/?p=3886 http://fb.me/YiZLU0mN,,,,en,,Boucherie West Village 
98,Eater NY,@EaterNY·2016年12月10日,2016-12-10,A huge French brasserie recently opened in the West Village — say hello to Boucherie,,5,14,en,,Boucherie West Village 
99,Tuneries,@tuneries_foods·2016年12月10日,2016-12-10,Boucherie Now Slinging Steak And French Classics In Massive West Village Space... - eater https://tuneries.com/tuner/share/201398/0/tw…,,,,en,,Boucherie West Village 
100,hundred twenty one,@10021eats·2016年12月9日,2016-12-09,Boucherie Now Slinging Steak And French Classics In Massive West Village Space http://ift.tt/2h5UMCT,,,,en,,Boucherie West Village 
101,SLOW Brooklyn,@SLOWBrooklyn·2016年12月9日,2016-12-09,Boucherie Now Slinging Steak And French Classics In Massive West Village Space: A former Pastis chef is cooking at… http://m.tbnn.it/MrYqsg,,,,en,,Boucherie West Village 
102,TheLadyJStyle ,@The_LadyJStyle·2016年12月9日,2016-12-09,Boucherie Now Slinging Steak And French Classics In Massive West Village Space,,,2,en,,Boucherie West Village 
103,Eater NY,@EaterNY·2016年12月9日,2016-12-09,A huge French brasserie recently opened in the West Village — say hello to Boucherie http://ny.eater.com/2016/12/9/13898672/boucherie-nyc-opens…,,3,6,en,,Boucherie West Village 
104,Soho Daily News,@sohodailynews·2016年12月8日,2016-12-07,New Brasserie With Former Pastis Chef de Cuisine Opening in West Village: Boucherie is set to open at 99 Seventh… http://m.tbnn.it/Mqr3yl,,,,en,,Boucherie West Village 
