,opinions
104,"booked for my partner birthday on gold setting , service and show was excellent, only let down was I booked and paid for Celebration slice of cake with sparklers but they only drop the cake on table without any candles or sparklers which was very disappointing and celebrating was the whole purpose of the booking. Apart that I would highly recommend it."
105,Had a lovely evening at the cabaret with waiters like Adrien who are so attentive and kind. An absolutely amazing night with my 10 girlfriend.
106,"We didn't know what to expect after we have seen a fantastic cabaret in Paris. The show was amazing and an overall experience was way much better than Paris one - you have an amazing show, live sax, fantastic meal and service, add DJ playing some great tunes and dancing into the night - for me it was a perfect cocktail for the very perfect night out. I am already planning to return for my birthday because there is no hassle of going for drinks somewhere, then for dinner somewhere and the ghastly thought of queueing up for a night club! Quality time at London Cabaret."
107,"From the moment we arrived it was amazing, the venue, the dancers and singers, the staff, the cocktails and the food 10/10 couldn’t fault it - drinks flowed the show was brilliant and the food tasted amazing. DJ was brilliant everything almost felt normal again it was a brilliant thank you all so much - we will be back again"
108,Had a great night at Cabaret Club last week. Loved the show and the food was amazing. Staff were exceptionally friendly and attentive especially Constantin who looked after us for the duration of the night. Definitely will be going there again in the future.
109,"Amazing show, excellent entertainment!! A night full of amazing dance and the show like no other! I loved every second of it."
110,"I’m a big James Bond fan and had very low expectations going into this. I’ve never been to cabaret before and thought it might come off as “tacky” or “Karaoke”. Much to my surprise the singers were very good, especially one of the men who had amazing vocal range and made Sam Smith’s Writing’s On The Wall from Spectre very listenable! There were some impressive acrobatics and more Bond songs which kept me engaged. A couple of “filler” acts such as the “laser girl” were absolutely awful and served no purpose though. The 3 course meal was actually very edible which was surprising. Any Bond aficionado would have a good time here and it’s a good night out for a group of you even if you aren’t into the world’s most famous, fictional spy."
111,"I can't say enough good things about the London Cabaret Club. Staff were welcoming and attentive from the start. There was an air about the place that you were attending something special (some people attend in black tie) but there was no particular dress code and it did not feel pretentious. Although drinks were expensive, this is massively offset by the value of the tickets. The entertainment was exquisite. The performances impeccable, the choreography and costuming beautiful. The performers were just fantastic. There were three acts with a lively DJ keeping everyone entertained between set changes. The best thing about this event was that you get to experience the talents of the west end but in a more intimate setting but you also get the party atmosphere of being in a club. Absolutely love love loved this, best night out since before Covid! Can't wait to come back for a Halloween or Christmas show! Thanks for the memories London Cabaret Club!"
112,"Fun filled evening out Fantastic DJ wicked playlist for all music types Beautiful venue, Waiting staff are very attentive, helpful and courteous. Show and performances is wow amazing . A real party atmosphere. Mixologist lovely cocktails James Bond theme."
113,Best atmosphere and great service! Shout out to the sexy saxophone guy :) and to our excellent waiter Addrian (soz for spelling) such personable service and a great French gent :) big love! A great experience
114,"A James Bond turned festive medley that would have Sean Connery turning in his grave.  The service was atrocious - 90% of our orders were incorrect and the staff had the audacity to react as though we were the ones in the wrong! That didn’t stop them from trying to charge the inflated amount though....plus a service charge for the inconvenience! Thorough ineptness from start to finish - never again!  As for the entertainment....average at best. Despite paying for Gold tickets...we were very nearly sat in the next room - which wasn’t necessarily a bad thing had it not cost quite so much - and delivered so very little! Aside from one or two performers, the remainder was akin to a dreadful karaoke night in your local pub and a cabaret worthy of Phoenix Nights. I feel thoroughly disappointed and disenchanted by my experience - it was entirely shabby!  The roller-skating duo were by far the highlight. A true skill and hugely entertaining - other than that, the night was little more than a huge disappointment....and most definitely not the night we’d signed up for.  Having been to Lio a year or so ago at the same venue, tonight came a very distant second.....and one that I very much begrudge paying for."
115,"We had an amazing night, the food was incredible and the show 10/10. All the staff were really friendly, especially Constantine. Would recommend this experience to anyone, very much worth the money,"
116,"This may appear like an expensive adventure, however, it is worth every penny, and let’s face it, we all drop £££ on a London night out.  The food: not the greatest, but that’s quite normal for an establishment that isn’t a restaurant.  The drinks: an array of choice from average wine and beer to delicious champagne and cocktails.  Service: attentive and friendly  The performance: PHENOMENAL. Heart-warming, outstanding, breath-taking and incredibly enjoyable. The performers themselves were next level!  I advise that you dress up. You don’t need to but it really does add to the overall effect and enjoyment of the evening."
117,"Booked a royal diamond VIP table for 2 which gave us a great meal, view and overall experience. It was definitely worth the money. I am looking forward to returning next year when hopefully the restrictions will be lifted and can party the night away. Very friendly staff and great show. I have even received an extra desert for my birthday and a drink for myself and my husband. Really good show and atmosphere considering Boris was announcing a second lockdown same evening. The lengths the staff went to ensure safety but also a fab show are incredible. I feel sorry for them as they are unable to work throughout as everything was very well managed and it definitely felt safe. The stake was really good as it was the rest of the meal but I remember the stake the most as it really was great The only thing I would do different would be to pre order the drinks as you get a discount bit even without it we had an incredible night."
118,Epic!!! Excellent night and great/friendly staff. Would highly recommend and would love to go again!
119,"Everything was amazing! Show was fab, food and drinks were great and Avram looked after us so well and catered to our every need! Thanks Avram and everyone at Cabaret Club!"
120,I love the show also I saw a nice dog on the stage. Definitely I will come again and avram make us a good service.
121,"After long time we went out, the Show was great service was great, also Thanks for Avram for the service. We recommend the venue. Must visit"
122,"Had such an amazing night.. I booked this venue as a suprise for my Husbands birthday im so happy I decided to go here... The food was fabulous and the service was excellent, staff were so friendly and the show was fantastic. Special thanks to Jerick who was looking after our table, thank you all for an awesome night. Will definitely visit again."
123,"I was disappointed to see one of the entertainers use a number of live birds in the performance (All About Gatsby). The birds were kept in confined spaces and I’m sure the loud music and flashing lights would be distressing for them. Suggestion to the venue would be to make it clear during the booking process that live animals are used in the performance, we would not have attended if we had known"
124,"Everything was perfect, I booked the Diamond package for £125pp without drinks and I would within a heart beat book it again. The place and the theme are so well arranged, the food is delicious, the staff friendly and the show...there is just no word for it. I was seriously so happy all through the evening and my guests (coming from France for the occasion) were absolutely delighted. I have been sharing pictures and talking about it with everyone I could."
125,"Food and drink service terrible. We kept getting missed out and had to keep asking. Duck was dry and chewy. Asked for my cocktail as soon as we sat on table, I had to ask again during main course, only to be told its not available! Show was ok... expected a Gatsby theme to be more Gatsby but they kept playing these noisy club songs during intervals, some songs sang were remotely related to Gatsby, not even its genre. Shame the performers were good. I was looking forward to this night but got very disappointed. Might want to change show title or keep within the theme? Cloakroom - had to ask if there was one,none offered at entry/ reception. On way out to collect, coats given and they completely forgot bag, again we had to ask after about 10-15 mins waiting"
126,"booked to go with a group of 13 for my 21st. We travelled for two and a half hours to get there, one of my friends were travel sick and was sick in the toilet. She was kicked out for this meaning we all had to leave after an hour of the show beginning. We explained to them that she had recently had an operation and that it was due to the travelling but no one would listen. We were with an older group, some aged 70 and still couldn’t not get listened to. We spoke to the manager, Mike, who was so so rude! He did not understand at all and was very sarcastic and patronising. An awful experience & my 21st birthday was ruined as a result. When we first arrived we had been accused of hiding our drinks under the table by 2 staff members- we did not do this and even showed them under our table. We wasn’t offered an apology for this accusation. The food had been ordered with one vegan dish, yet all 13 of us received a vegan meal. Food was cold, alcohol was cheap and struggled to get much alcohol as we would have to wait until all finishing our drinks before receiving another one and sometimes had to wait up to 15 mins to be served. I would definitely not recommend this as a place to go. Very very inconsiderate and rude staff. We spent nearly £800 amongst us to be forced out after an hour. Do not waste your money"
127,I attended the Great Gatsby show with friends and particularly enjoyed the charleston danse moves and the high end acrobatics. Lovely jazzy atmosphere with attentive staff and talented artists. The performance was dynamic as you are immersed in a continuous flow of acts that unfolds around you. A great opportunity to sit back and be entertained in a stunning art deco ballroom. There is a possibility to party and danse at the end of the show if you want to linger for a while. Great place to party with a group of friends.
128,"Just wanted to take a moment to compliment the service we received from Avram on Saturday evening. My girlfriend and I had a lovely overall experience - both in terms of spectating an exquisite cabaret show performed by a group of professional dancers and the customer service side - which was way above standards as a result of the outstanding effort of Avram and the rest of the team ever since we arrived and throughout the evening.  All in all, very impressed with the 10/10 customer care and we will definitely come back again soon."
129,"good food, great preformace and really kind staff! If you like dance and singing preformace this is a place to visit."
130,We have just walked out of the show. It’s was tediously boring. The concept and the show has so much potential but it’s so boring and the food is just meh. It’s trying to be this posh venue with posh food but it is horrid. The lamb and desert was nice but the other course were not. We left before the final course because we were just board. The performers are talented but the set up does nothing for them. Disappointing and a waste of £250
131,All the acts were extremely entertaining. Drinks are expensive but similar to any upmarket restaurant in central London.
132,"17 of us arrived here for my friends 40th birthday party, wasn’t very impressed when we arrived no tables to sit at just stood around waiting for 40 minutes until we could go through to the show area. Loved all the dancers and they had amazing outfits, the magician was excellent and still don’t know where the parrot came from, the food was ok nearly all ours was cold when it came to us. But the show made up for this, we loved that we could get up and dance, we thought the bottles of Prosecco were a bit over priced as well."
133,This was a lovely experience. Six of us did the dinner and show experience and it was met with consistent compliments from our table. Would definitely recommend to anyone. The pre drinks in the bar are also an amazing prelude to the overall experience.
134,We were a group of friends who just wanted to see a fun dancing show. The Cabaret Club had amazing 3 dancing acts. The dancers had beautiful outfits that matched the theme and they really kept us entertained. I would definitely go back again.
135,"I was with my friends to London Cabaret, We had pre-drinks and a nice lounge and after the show starts we got a nice table and we want to thanks to Avram for a wonderful night. You must visit"
136,Avram looked after us whilst we were out for our company Christmas Party last Thursday night and I have to say that he was the best waiter that I have ever had. There was a large group of us but Avram was always there to get us what we needed in a flash. Highly recommend this venue for corporate events or work parties. Give the man a raise!
137,"I think if you were drunk and someone else was paying for your night out here, it would be great. However, at about £15 for a margarita and £19 for a glass of champagne, we limited ourselves to a drink each. The entertainment came in 3 batches, with long periods of noisy chart dance music inbetween. It was all a bit flat - a few magicians (one using live animals), dancers (some of the women's costumes were spectacular I have to admit) and a cute dog called Maisie who did a few tricks. But the entire point of the evening was really to sell as many of their overpriced drinks as possible to groups of drunken work parties. Staff were mostly very attentive and friendly - except the woman on the reception who looked like she'd like to be doing anything else rather than dealing with you. Overall, it had a very soulless feel to it. I would definitely not go again."
138,"Took my wife in her birthday with son and daughter and had a really wonderful night of entertainment. The service was superb throughout, food very good but the entertainment was special. They kept us entertained for two hours with spectaculars, truly getting the audience involved. We will return!"
139,Wonderful experience with friends. Great talented people on stage! Beautiful Christmas decorations as you enter the place and nice atmosphere. You can see the stage in any area you sit in. The staff was great!
140,"From when we first walked in, until we left. Felt like you were special, the ambiance, food, show amazing. Not cheap but worth every penny."
141,"Don’t be tempted by the wonderful descriptions on the website, this is a rip-off. Drinks are overpriced, service is poor, cabaret is a joke but like all gourmet restaurants they do serve margarine with your bread at dinner. If you want to be mugged, buy a ticket."
142,"really good evening , cabaret was fantastic and went on for a long time , food was delicious and service very good, overall great night out , only negative was the price of drinks was horrendous!"
143,"Horrifically bad high school musical calibre entertainment. We left after a couple of acts. £16 for a gin and tonic made with the cheapest of gin. Our tickets were free and I still feel like we were robbed. I can only imagine that the 5 star reviews are from staff. That, or people from a parallel universe where the good version of this show is happening."
144,"Very high end and classy establishment near Holborn station!! An expensive evening out, but well worth the price you pay as the entertainment is phenomenal! Live singers & musicians accompany each cabaret act to create a spectacular show! It was amazing to see the amount of work the artists put into the Queen of Roses to create a really special show! Even the costumes used were over the top and unforgettable! We didnt have dinner but we ordered a few luxury cocktails at about £10-15 per drink. They offer an extremely small selection of beer here, but unfortunately no cider. Completely out of our budget but we still had a great time!"
145,"Booked this as an anniversary celebration. Wish i had read the tripadvisor reviews first, however I only ever look at these when i am travelling out of my hometown. Trash from start (I cant say to finish) as could tolerate the absolute joke of apparent entertainment. The bar service was slow, overpriced and despite booking to pay for seats the place was full and people were almost sitting on our laps, the food was cold, only had the canapes, and starter as the 3rd course was luke warm at best, we asked for a replacement and this was again not up to serving standard. Gave up and asked for the bill. Was offered a bottle of wine but this would have meant having to stay and finish watching the entertainment and it was embarrassing to watch. I know that everyone has a living to earn but i would guess that the show was thrown together in half hour and I almost felt sorry for the acts. You would have had to be off your trolley to have found it entertaining. Was given the operations manager detailed info and did write an e mail with my feedback but heard nothing. He perhaps agreed with me. Tickets were £250 with a booking fee of £25. Along with a bar bill of £100 made a very expensive night and left feeling like we had been mugged. You have been warned, save your money!"
146,"I am very disappointed . Intially i waited 45 minutes for a a table, and once we went over and me and my mum sat down the chair was not stable and once sitting at the table with my mum after a while the chair collapsed and broken and fallen on my foot, which has caused me great pain but I did not want to leave or make a scene as my mum wanted to visit this restraunt as it was recommended by her friends. The service was terrible. the staff did not immediately attend the table for help or to even change the chair that was broken after a very long time... I then requested for the bill and had to wait a disappointing time almost on a hour.. Health and safety and customers are clearly not a priority here. Once I was paying for the bill they took my card AWAY from the table on arrival and once giving the card back they gave me another persons card by accident, which shows that the staff has no awareness or care for other peoples property and could have accidently given my card to someone else if I had not double checked the card that I was taking home with me. I do not recommend this restraint at all, they did not even have the curtesy to apologise or take money for the bill. I have now had to find a lawyer to assist me with this case as I do not believe that I have attended a peaceful meal to leave with an injured foot. I understand that that trip advisor has a policy on writing fake reviews, this is not fake I would recommend you spend your money elsewhere!"
147,"1) WITHOUT THE DANCERS, THE SINGERS, THE ARTISTS AND THE INCREDIBLE PERFORMANCES THAT PLACE HAS NO VALUE, loved it!!!!  2)the FOOD was LITTLE, when i read ''5 course meal'' me and my friend didn't eat all day !!!!!!! coz we thought the food was massive . But actually ... we were constantly hungry, I felt like it was a constant STARTER. we wished we ate earlier . The salmon main / LAST meal was good.  I wish i could FINISH MY CHEESECAKE instead of them taking it away after few minutes. i usually LIKE to take my time to eat when i spend over 300 £ for an evening, thanx.  3) '' Royal Diamond PAckage'' = you can socialise witht he stars in the lounge with exclusive VIP area and DJ = == *** Artists don't want to socialise, they were obvously tired and they wanted to relax after the show. + Lounge area? socialise?!? 50 - 60 -70 year old DRUNK half sleepy / FAT people and milfs dancing like hoes and going home after few minutes you call that socialise?  WHAT VIP AREA!? the tiny space of sofa in the middle of the room with a few plates of cheese and bread on the table without extra care or extra attention to us ?  I'm not sure how it works in London, maybe 300 £ is very LITTLE price in order to demand attention and care,sorry! but at least don't make it SOUND BIGGER THAN WHAR IT IS PLEASE! BECAUSE IF I KNEW IT, i would have eaten OUT first and then come to see the performance."
148,Fabulous show and food! Beautiful surroundings and a really lovely night out for myself and my teen daughter. Will come back and highly recommend.
149,"I booked this last minute with a friend as we were in the area and wanted to see a show. It was fun. We saw the 'Queen of Roses' show which had a variety of performances. The performers and musicians were fabulous and our waiter was friendly.  We only took the silver package, which I am pleased about because I could't really identify the value of the more highly priced packages. Our seating was fine - our view was clear and unobstructed. Some of the performance was directed towards the opposite side of the room (VIP section), but I suppose they need to give that side something for the price that they had paid relative to us. The food is a set menu so you get what you are given and quite expensive for what I saw people getting. We were much better off going to a nice restaurant beforehand. The alcohol was extremely overpriced.  In all a fun night and a good one-off experience."
150,"We were a group of 10 ladies and we visited the London cabaret show on 26th October so it was decorated for Halloween. It is a beautiful venue. We arrived in time for half price cocktails which were incredible. The bar staff were lovely and had a bit of banter with us. Whilst we were in the bar area there were singers and entertainment whilst we were waiting to be seated. We had great seats but to be honest the stage is in the centre of the room, so all seats are good. Because we were a big group we pre ordered drinks which were at the table waiting for us. The staff were so friendly and accommodating and also had laugh with us. The show was incredible, we loved every minute of it and I’m already planning my next trip to the London cabaret show."
151,"Not my sort of place at all. Visited to hear a cricketing talk given by two former England players. The venue reminded me of the cabaret/casino clubs I used to visit in the North East when I was at university - all velvet, chrome and dark corners. Plainly I am not target market for this type of venue and there is no accounting for personal preference, but I do have a strong preference for not paying more than £30 for 4 small bottles of mainstreanm Belgian beer (Leffe Brun 330 cl)."
152,"I was immersed into a showstopping extravaganza of top class dining combined with a cabaret fusion of song, dance, opera and circus which frankly put Strictly Come Dancing into the shade.  From the moment I entered this glitzy Bloomsbury Ballroom, the whole place buzzed with an ambiance of eclectic mix of music and dance. Dazzled by immaculately choreographed performances in Queen Of Roses and Hats, Horses and Hounds, with colourful costumes and superb attention to detail, it took me on a unforgettable trip through English history.  In the heart of West End only 4 minutes walk from Holborn tube station, you can forget Theatreland and head straight for The London Cabaret Club for a jaw-dropping cabaret experience like no other. Eat and be tantalised: A must see show!"
