,opinions
50,Been here a few times now as I love show and dinner experiences and this one never disappoints. Food is always great and the shows are fun. My favourite show is the Gatsby one!
51,"Fantastic afternoon celebrating my 50th with my sisters. Singers, dancers were amazing. Everyone got up to dance and sing. Atmosphere brilliant. Special thank you to Gillian at West End Musical Brunch and James at Sway making it even more special with Moet and care and attention xx"
52,"The food was lovely, the drinks were yummy but most importantly the atmosphere was electric! Loved the dancers and the acts and would highly recommend to anyone wanting a fun night out."
53,"Gatsby Christmas - we attended Fri 3rd Dec on drinks-only tickets. We were disappointed that our table wasn’t ready when we arrived and the staff seemed confused and cobbled something together - 4 people paying £75 each crowded around a poseur table designed for two people at best. The drinks service was fine and attentive. There were some good acts and performers but the show was disjointed and had no flow at all. Poorly planned. Compared to other similar events I’ve been to before, this felt a bit of a let down."
54,"It started of as an occasiin for my partners birthday, then he proposed. Beautiful place & entertainment was amaxing. A nice occasion to get dressed in your best dress. However, as it was my partners birthday I asked for it too be announced, cost £50 for that, total disgrace as already had paid £336 for tickets & 1 bottle of wine. Definitely should be complimentary for birthday announcements etc. Our engagement was not even acknowledged. The staff are all amazing, so professional & helpful. Would highly recommend."
55,"A great evening of entertainment. The performers were talented, particularly Hannah who has an incredible voice. The only thing I'd improve is the food, which was mediocre."
56,"Due to last year's lockdown, we had to rebook our 'London Never Dies' night. Rebooking was easy and we received a confirmation email last month. Although it referred to a menu selection and pre-ordering drinks, we had no further communication from the club until the evening before the performance. After a couple of calls and emails, our menu choice and drinks package was booked and paid for, but it was all very last minute. The performances were all good, with some exceptional singing and a couple of stand-out BGT-type performances. In between the acts, the DJ played plenty of dance music which got people in the mood for when the tables were cleared away towards midnight. Still not entirely sure about the 'act' with one of the singers and a dog....either way, I don't think it went as planned. Our 'Gold package' gave us a choice of meat, vegetarian or vegan options, but with only one choice of starter, main and dessert - but you could mix and match if you wanted a vegetarian starter and a meat main course. Although the entertainment started around 7:45pm, the starters did not come out for over an hour and we received our main course around 10:30pm - even though some tables around us had the mains already cleared away. Maybe understandable, given they are catering at a grand-scale. The other issue is that a number of the waiting staff do not have English as their first language - no problem with that, but my wife asked one member of staff where the toilets were, but she said she did not understand the question. So we had to ask another member of staff who was able to oblige with the necessary directions. As you would expect, the drinks are not cheap, and the cocktails in particular are rather expensive, so if you've not got work the next day, the bar bill might mean you putting in a few hours of overtime. So overall, a good experience, but we're in no hurry to go again.."
57,"I wouldn’t call this a cabaret club, the performance was quite disappointing and resembled a school talent show more than anything. There were a few good acts that saved the night but apart from that it was quite disappointing. A lot of long breaks between the acts too, which made the whole thing rather disjointed. I would not pay full price for this, there are a lot of other better cabaret clubs in London."
58,"I bought 2 silver booth tickets to see the El Dia Of The Dead on Friday 29th October for my hubby's bday. When we arrived at the entrance desk and showed our tickets, there was initially a problem with our table - we were supposed to have table 14 but were then switched to table 31, have no idea why! We were asked to sit down and wait while they sorted this out. Then, once the issue was sorted and we arrived at our table, it took 1 HOUR before we even had a drink! We had no idea who was supposed to be serving us as no one came up to us for a long time. I then just said I would just go up to the bar to order us a drink and was stood there for ages with none of the bar staff even looking at me. It wasn't until I asked if I could order there until I was told that there should be table service and they would send someone over. Finally, a lady came up to us and asked what we would like and noticed we didn't have a drinks menu, so she disappeared off for at least another 20 minutes until she came back with a menu.  We ordered a bottle of (very expensive!) Wine, which was delivered to our table by someone else and just left in the bucket. It hadn't been opened (it had a cork) and we didn't have glasses. We were sat waiting for a long time yet again for our waitress to come over and open the bottle for us! The wine itself was definitely not worth the extortionate price we paid for it either, very sub par.  Everywhere just seemed chaotic and unorganised and we felt forgotten about. The show itself was ok but there was a long wait in between performances, probably to get you to buy more ridiculously priced drinks! They also take away your card at the point of ordering and you only see it again when you leave! I did not feel that this experience deserved a tip so I didn't bother. We left before the performance finished.  We definitely won't be back sadly and was not worth the price we paid! A shame to have experienced this for my Husband's birthday."
59,"Rude bar staff, mediocre entertainment & expensive drinks which are sub par. The Halloween 'after party' was poor, the bar area was drab and dingy and the music was only playing in the main ballroom and only filtered through to the bar through an open door. The event was also promoted at 10:30-3 but we were asked to leave the ballroom at around 2 and music switched off at 3"
60,"The basic package prices are good value for money for a fun night out. You get little more for the more expensive packages and you are treated no differantly. The entertainment is nothing special but the singers are superb. I got the impression, that having listened to Bond music all night on a halloween themed evening, that its just the music from London never dies replayed in halloween costumes. The whole night revolves around alcohol induced excitement so you are guarenteed a loud fun atmosphere. The entertainment is predominantly diversity in later years not a lot of variety. The food was good but a little on the cold side and took forever to be served. The drinks are not cheap so be prepared for an expensive night."
61,"My wife and I had a wonderful time at The London Cabaret Club celebrating our first wedding anniversary. All the staff took excellent care of us; the performers were incredibly talented; the food was delicious (although different from the menu we'd been sent); and the environment was beautiful. One thing that was disappointing was the lack of diversity in the performers- they were all white. Most of the serving staff who were out all the time were white too, with black waiters coming just to deliver food. We felt uncomfortable about the clear race divide in the club and would be interested in reading their diversity and inclusion policy to see what they are doing about this."
62,"It’s an evening full of entertainment, it definitely doesn’t disappoint. The food was good but at least one choice on starter main and pudding would make it great drinks are expensive which overall is to be expected, however the near 15% charge they put on top is very over the top. Bordering on rude…."
63,"I was celebrating my 60th birthday with a friend and we both thoroughly enjoyed the whole experience from start to finish. The performers were polished and very talented, the venue was impressive, all the staff were professional and friendly, the food was great and the DJ certainly had everyone up dancing. We will both definitely be coming back!"
64,Amazing experience! The performances were really good and to a high standard. it is 100% worth the money
65,"I had a very special occasion that was tripled pleasure because of all the support i got from the team , specially Ms Izzy during my reservation and follow up, my partner was crying from happiness and joy, the program was amazing , the night was long enough till 3 am to be part of our happiest memories"
66,"Enjoyed the night, the food was great and the show was amazing. Would highly recommend and would definitely go again."
67,"Purchased the gold tickets for a Saturday night, the entertainment was ok but the food was really awful and the whole thing seemed well overpriced. We were sat at the back and none of the wait staff seemed able to locate our table so kept delivering our drinks and food to other tables, at one point our main courses were left sitting at an empty table for 20 mins and then delivered to us cold, we didn’t bother eating it was that bad! The show was fairly good with some impressive acts but almost as entertaining was the shockingly bad service! We wont be returning unfortunately :("
68,"Amazing night, great performance and music. Great service as well Adrien our waiter was extremely helpful:)."
69,"Show - 5/5. Great singing and dancing.  Seating in theatre - 5/5. Great view of show in VIP seats.  Pre drinks - 1/5. Although we’d pre ordered drinks, these were not offered in pre bar. Therefore, we ordered extra drinks which were very expensive (even for London).  Drinks package - 2/5. Limited beer choice. Expensive. All lager opened as soon as we arrived at table and went flat.  Food - 1/5. Did not consider allergies, albeit pre advised. Cold when served. Canopy - awful. Duck - cold and tough. Fondant - sad.  Service - 1/5. Rushed. Impersonal. Did not consider pre orders or allergies. Did not bring back credit card after 3 requests. Had to go to bar to retrieve.  Overall - not a VIP service. Only saviour for the evening was the entertainment and seating (which I accept are key). Other than that: food awful; drinks overpriced and service poor."
70,"If you are looking to see London in all its glory, please go see a show at the London Cabaret. We had the best seats in the house and the experience was second to non. Geric our waiter made the experience even better by being so good at his job and for our second wedding anniversary we couldn't have asked for a better night.  Food was amazing, drinks were amazing, service was amazing, please if you can, book a ticket to go here.  You will not regret it."
71,"Adrienne was amazing, so Friendly and helpful on our first experience here. I came to celebrate my birthday and had An lovely time. Thoroughly spoilt. Adrienne and Jonathan looked after myself and my husband brilliantly Thank you xxx"
72,This was my fourth visit to the Cabaret Club - each for a special occasion. There was a brilliant party atmosphere - the performances in the cabaret were top-notch (West End show standard) and the food was delicious. All in a stunning art deco ballroom. I live in London am delighted to have found the London Cabaret Club.
73,"Pros: It is a nice evening and wonderful change from the normal nights out in London. The artists are extremely talented and there is a wide selection of performances from dancing to acrobatics. Very entertaining! The food is good. A nice selection on the menu and the drinks are very good (cocktails and quality of wine). The service is a little rushed but nothing too offensive at all. Cons: The only downside for us is that we originally booked Gold tickets, stage side. As the menu was less impressive (chicken), we upgraded to the diamond package. We asked that it was stage side and were told the diamond seats were the best but when we arrived, we were walked to the back of the hall on a raise platform. Our seats were at the back on the side sitting next to each other which meant we had to turn 90 degrees to view the entire show whilst blocking each other and eating on a circular tables. It is as awkward as it sounds.  My best advice is to stay stage side where all the action happens and you feel part of the show. Or maybe to ask for a seating plan ahead of time and base your ticket selection on that.  That aside, it is a great night made special by the performers and the general ambience."
74,"Absolutely fantastic, 17th september show, service was 10/10 performances INCREDIBLE. we finished this night and called some friends to tell them we need to rebook. see you in december!"
75,"Lovely venue, good food, attentive staff and first class entertainment ... all the ingredients for an excellent night out which my wife and I certainly had. Will be visiting again as soon as time allows."
76,"Great evening and enjoyed the dinner, very polite and helpful staff . Would definitely have a return visit"
77,"Good experience but not 100% satisfied. Long gaps between performers. Many staff around but still couldn’t get best table service. Our bottle of wine was left on our table without opening. Twice asked for cutlery, because twice our meal was served just on a plate without the cutlery. A lot of confusion about menu. The show was great but in 2 hours only 30 minutes were the real performers , the rest of the time was DJ’ music."
78,"My boyfriend planned a Saturday evening as part of my birthday surprise last weekend. There was a bond themed cabaret night. The acts were great to watch, however they were quite short and there was very large gaps. The drinks menu was diverse but very pricey with cocktails priced at around £16 each. I would recommend definitely trying this place once"
79,We attended the Carnival evening - the entertainment was pretty good but lots and lots of padding took place and seemed to be a mix of everything thrown together We pre ordered drinks expecting them to be on the table in an ice bucket but no it took about an hour to finally get them Lots of confusion over our food also - there were lots of staff but no one seemed to be able to resolve anything Perhaps the organisers should visit Benidorm palace to see how this night should and could be
80,My husband and I were visiting London for our wedding anniversary and decided to book something different that we haven’t experienced before in London and this did not disappoint! The staff were attentive and our waiter Johnathan was a pleasure to be around very polite and a great conversationalist which made our night too. The food was amazing and well presented and the most important part was the very talented entertainment we received throughout the whole night. It was spectacular and exciting and we would definitely return to experience another evening like this at the London cabaret club.
81,"We enjoyed the night. Initially concerned about the ticket price but given that we were in a well spaced venue we believe we had value for money. It was very noticeable that many tables, including ours were restricting their drink purchases because of the the extortionate prices. I became increasingly agitated by the inhouse photographer constantly walking in front of us and on more than one occasion told him to move. I paid to see a show not the back of the head of your publicity staff. The night was themed as Carnival but other totally unrelated acts were put into the show to pad out the event. They were good but left us confused as to why they were included as they bore to relationship to carnival. Having seen the Rio Carnival in 2020 we can definately say the Brazilian part of the night was very authentic The evening was disjointed with long gaps between each set of entertainment, these gaps were filled with some guy with angel wings banging a drum which after the first circuit became annoying rather than entertaining. The food was spread over 2 hours which for a meal was well dragged out, the dishes were surprisingly tasty but served tepid. Best advice is to eat before the show, drink well before the show, buy the drinks only ticket and just buy a beer for the duration"
82,"Booked the Cabaret for the James Bond show! My partner and I were greeted by the young ladies at the front desk, both were very polite and helpful throughout the night, catered to both me and my wife with amazing service. Unfortunately, I was a witness to poor management half way through my night, from what I could see the manager kept raising his voice to employees. I was also waiting for quite a while to speak with the young lady from the desk, but could see she was caught up with the manager who seemed to be acting quite inappropriate and unprofessional. All in all the show and performers were amazing… however service and management were below the standards of what I was expecting."
83,"An absolutely amazing evening, filled with spectacular talent and superb cuisine, surrounded in great company of friends! The hosts were so attentive, it truly felt so wonderful to enjoy being wined and dined all over again- we didn't want this evening to end! There is honestly not a bad seat in the house. Thanks to all at The London Cabaret Club: 100% 5*"
84,I took my mum to London Cabaret club for her birthday and I wasn't sure what to expect because I hadn't really heard anything good or bad about it. It was fantastic. The food and entertainment were spot on. It was a great evening
85,The service was quite poor and somewhat rude. We were put sitting in an empty area where we couldn't experience any of the entertainment until we asked to be moved. We were moved eventually but felt like half the night was wasted.
86,"Brilliant food, service was above and beyond, show was excellent and the members of staff made the night by getting involved and making sure the best night was had by all. Most definitely recommend."
87,Amazing show with lots of performances. The singers had amazing voices and the dancers were really good. Was served by Adrian throughtout the night. He was so helpful and lovely. This was my first cabaret show and certainly won't be my last 😊
88,"Not great acts, very slow service, average food.  Worst cabaret I’ve ever seen, would recommend proud or black cat or the smaller crazy coqs.  For example an unexpected dog act; the dog just came onto the stage waited, the trainer pleaded with it, and then it ran off with out doing any tricks."
89,"All round quality experience!! I took my friend who came over from Belfast and we chose the gold package to go all out and I’m so pleased we did. We pre ordered our cocktails prior to arrival for the whole night so there was nothing to settle and they already had a list of our wanted drinks for the night and preferred meal choices, so you literally turn up and are served on. We were sat right in front of the stage and the food was absolutely divine. The show, service with a smile and atmosphere made such a welcoming and classy experience. Even the after party just topped everything off! I would recommend to all!"
90,best show we have been too for years from start to finish. all the staff superb especially victoria c. food was piping hot and top class show was really entertaining .can not recommend this show enough you wont be disappointed. we booked gold tickets they were perfect
91,"My partner and i went there for our 12 anniversary and booked it online that day- we didn’t really know what to expect but was pleasantly surprised how amazing it was. There wasn’t a dull moment. The performers were just brilliant. Dancing was amazing- costumes beautiful, we will definitely return x"
92,We were so excited to she our first show since the pandamic. Actually able to go out for an evening. Singers & coriograghy very amiture. Drinks expensive. Good DJ though
93,"Brilliant atmosphere, great food, exceptional service and a spectacular performance. Highly recommend!"
94,"Great night out, fun atmosphere and tasty food. Really friendly, happy, helpful staff. Drinks a little pricey...."
95,"We were seated on high stools which my friends had difficxulty getting on. A member of staf must have noticed as we were soon moved to a booth with banquette seating,much easier and safer for them. We still had a good view of the stage. The costumes were spectacular,even involving glittery masks!"
96,"We had an unexpectedly wonderful eveing. Great welcome, great singer, great location and fantastic DJ and dancing in the ailes. Food up to expectation and wine not cheap but what an evening and so surprising. We will be back for halloweeen."
97,Brilliant night start to finish staff were lovely and the show was brilliant defiantly recommend this club to small groups or couples
98,"After several attempts of seeing this show (due to pandemic) we finally managed to see the show at The London Cabaret and it was worth it the waiting. The whole process of booking the food and drink was really good so we didn't need to worry about that and the show went through out our dinner which was perfect. Really good show, amazing cast and DJ. A really different night in London"
99,"Everything was going well: the changes of dates were accommodated without any problems, the phone calls regarding menu were consistent. But when we came in as VIP canopies were sent with gluten, although during the call and an email confirmation stressed out ""gluten free"". Instead of canopies we received our starters which also were vegetarian section menu. For such a place and for such money I was expecting the chef to have an understanding that ""gluten free"" doesn't mean we don't eat meat! Offering vegetarian options! We didn't get a discount for this mistake overall the show was lovely and I would visit again but my hopes wouldn't be as high as I expected in the first place. And I wouldn't pay for VIP option either. Visibility of the show was excellent for everyone, I ate vegetarian options so I could have saved around 60 pounds on normal ticket."
100,Great evening / entertainment and acts very good / if it hadn’t been fir COVID restrictions it would have turned into a late night of dancing …. Recommended
101,"The show is great but that about it!  We were celebrating our anniversary and my husbands birthday. The day hadn't started well for us so we were late and missed dinner service. Wasn't too bummed about it as it was our fault but paying £250 for the package, i would have excepted great service and perhaps an option to dine in one of the other rooms so as not to disrupt the service in the main room.  Anyhow, my rating is purely based on the service we received and the overall experience and slightly influenced by management response when we approached them to share our experience; 1. I had organised a surprise anniversary and birthday wish from the performers to my husband. Apparently, they went ahead and wished him before we arrived. Management said 'we had just missed the announcement'. How do you wish someone when you know they haven't arrived? 2. We were supposed to get 2 free cocktails with our package. We were charged for all our drinks. When we brought it up, we were told we should have reminded the staff. I would expect the staff to have been briefed about the packages of all tables 3. We informed them during our booking that we do not drink alcohol. The drinks that were were served came with shots. The waiter also confirmed that it was alcoholic and we passed them on to the next table (who appreciated and enjoyed it). Management claimed it was soda water 4. We were seated at the worst table in the venue, even the standard package had better seats. We had 4 waiters constantly stationed next to us and all the traffic to serve drinks/food/ to go the bathroom was by our table. We saw most of the people's heads than the show. Felt like we were penalized for being late despite having paid and reserved the table. Late or not, we paid for it. 5. It felt like it was ladies night. The DJ kept playing ladies night music and it was just horrible. A stunt to get people to leave early perhaps?  When we brought all this up with management, they were defensive and just kept giving excuses. They offered us a 25% discount for the next show. Quiet insulting as that would be about £62 off a £250 package. of which apprx. £30 is the overcharge on the drinks that were supposed to complimentary. so... in short, we were offered £32 pounds off the next show. I am sorry if that doesn't excite me.  Was the show good, yes. Will i go back? No. Would i recommend it? I haven't mentioned it to anyone yet so..."
102,"The show was fun and exciting, it’s a great option for a weekend evening night out. The cocktails were great too."
103,We had the worst experience of our lives. The food was rubbish. I have eaten better in McDonalds. I was given the run around by untrained staff who knew nothing of the venue. When I phoned to complain the next day it took them nearly a week to phone me back and then they fobbed me off with excuses. I wasted over £300.00 buying Platinum seats that we never used due to stupid part time staff aand no compensation for their error.Do not waste your time with this venue you will have more fun watching paint dry.
